{
  "sektorMeta": {
    "id": "kimya-plastik",
    "ad": "Kimya / Plastik",
    "kdvRejimi": "KARMA",
    "gecerlilikYili": 2026,
    "guven": "orta",
    "netPozisyonTipik": "ODENECEK",
    "uiGrup": "imalat",
    "altDal": "uretim",
    "kaynaklar": [
      "2007/13033 m.1 genel oran %20",
      "KDVK 11/1-a"
    ],
    "notlar": []
  },
  "satisKalemleri": [
    {
      "urunKodu": "GENEL_MAL",
      "urunAdi": "Kimya/plastik yurtiçi (%20)",
      "kdvOrani": 20,
      "istisnaTipi": null,
      "matrahKaynagi": "brutSatis",
      "varsayilanCiroPayi": {
        "min": 0.6,
        "max": 1.0,
        "tipik": 0.85
      },
      "kaynak": "2007/13033 m.1 genel oran %20"
    },
    {
      "urunKodu": "IHRACAT",
      "urunAdi": "İhracat (%0)",
      "kdvOrani": 0,
      "istisnaTipi": "ihracat",
      "matrahKaynagi": "brutSatis",
      "varsayilanCiroPayi": {
        "min": 0.0,
        "max": 0.4,
        "tipik": 0.15
      },
      "kaynak": "KDVK 11/1-a"
    }
  ],
  "alisKalemleri": [
    {
      "girdiKodu": "HAMMADDE_20",
      "girdiAdi": "Petrokimya/reçine (%20)",
      "kdvOrani": 20,
      "istisnaTipi": null,
      "kovaTipi": "INDIRILECEK",
      "matrahKaynagi": "satMaliyet",
      "pay": {
        "min": 0.65,
        "max": 0.85,
        "tipik": 0.76
      },
      "kaynak": "2007/13033 m.1 genel oran %20"
    },
    {
      "girdiKodu": "YARDIMCI_KIMYASAL",
      "girdiAdi": "Katalizör/katkı (%20)",
      "kdvOrani": 20,
      "istisnaTipi": null,
      "kovaTipi": "INDIRILECEK",
      "matrahKaynagi": "satMaliyet",
      "pay": {
        "min": 0.03,
        "max": 0.12,
        "tipik": 0.08
      },
      "kaynak": "2007/13033 m.1 genel oran %20"
    },
    {
      "girdiKodu": "AMBALAJ",
      "girdiAdi": "Varil/big-bag (%20)",
      "kdvOrani": 20,
      "istisnaTipi": null,
      "kovaTipi": "INDIRILECEK",
      "matrahKaynagi": "satMaliyet",
      "pay": {
        "min": 0.02,
        "max": 0.08,
        "tipik": 0.05
      },
      "kaynak": "2007/13033 m.1 genel oran %20"
    },
    {
      "girdiKodu": "ENERJI_ELEKTRIK",
      "girdiAdi": "Enerji (%20)",
      "kdvOrani": 20,
      "istisnaTipi": null,
      "kovaTipi": "INDIRILECEK",
      "matrahKaynagi": "satMaliyet",
      "pay": {
        "min": 0.06,
        "max": 0.15,
        "tipik": 0.11
      },
      "kaynak": "2007/13033 m.1 genel oran %20"
    },
    {
      "girdiKodu": "NAKLIYE_LOJISTIK",
      "girdiAdi": "Nakliye (%20)",
      "kdvOrani": 20,
      "istisnaTipi": null,
      "kovaTipi": "OPEX",
      "matrahKaynagi": "faalGider",
      "pay": {
        "min": 0.1,
        "max": 0.4,
        "tipik": 0.3
      },
      "kaynak": "2007/13033 m.1 genel oran %20"
    },
    {
      "girdiKodu": "OPEX_20",
      "girdiAdi": "Diğer (%20)",
      "kdvOrani": 20,
      "istisnaTipi": null,
      "kovaTipi": "OPEX",
      "matrahKaynagi": "faalGider",
      "pay": {
        "min": 0.2,
        "max": 0.6,
        "tipik": 0.4
      },
      "kaynak": "2007/13033 m.1 genel oran %20"
    }
  ],
  "tevkifat": null,
  "iadeBaglantisi": {
    "tur": "IHRACAT_11_1_A",
    "motorRejim": "IHRACAT_ISTISNASI",
    "nakdenGecikmeAy": 3,
    "aciklama": "Ağırlıkla yurtiçi -> ödenecek; ihracat payı iade."
  },
  "karmaOranFormulu": "hesaplanan391 = Σ(brutSatis*ciroPayi*oran) [GENEL_MAL(20%) + IHRACAT(0%)] ; indirilecek191 = Σ(SMM*pay*oran) [HAMMADDE_20(20%) + YARDIMCI_KIMYASAL(20%) + AMBALAJ(20%) + ENERJI_ELEKTRIK(20%)] + Σ(faalGider*pay*oran) [OPEX: NAKLIYE_LOJISTIK(20%) + OPEX_20(20%)]"
}