{
  "sektorMeta": {
    "id": "gida-uretim-sut",
    "ad": "Süt / Süt Ürünleri Üretim",
    "kdvRejimi": "INDIRIMLI_ORAN",
    "gecerlilikYili": 2026,
    "guven": "orta",
    "netPozisyonTipik": "DEVREDEN",
    "uiGrup": "gida",
    "altDal": "uretim",
    "kaynaklar": [
      "(I) liste süt ürünleri %1",
      "KDVK 29/2"
    ],
    "notlar": []
  },
  "satisKalemleri": [
    {
      "urunKodu": "SUT_YUMURTA",
      "urunAdi": "Süt/peynir/yoğurt (%1)",
      "kdvOrani": 1,
      "istisnaTipi": null,
      "matrahKaynagi": "brutSatis",
      "varsayilanCiroPayi": {
        "min": 0.85,
        "max": 1.0,
        "tipik": 0.95
      },
      "kaynak": "2007/13033 (I) sayılı liste %1 (5189 s.CK)"
    },
    {
      "urunKodu": "ISLENMIS_GIDA_10",
      "urunAdi": "Aromalı süt içeceği (%10)",
      "kdvOrani": 10,
      "istisnaTipi": null,
      "matrahKaynagi": "brutSatis",
      "varsayilanCiroPayi": {
        "min": 0.0,
        "max": 0.15,
        "tipik": 0.05
      },
      "kaynak": "(II) liste"
    }
  ],
  "alisKalemleri": [
    {
      "girdiKodu": "CIG_SUT_1",
      "girdiAdi": "Çiğ süt (%1)",
      "kdvOrani": 1,
      "istisnaTipi": null,
      "kovaTipi": "INDIRILECEK",
      "matrahKaynagi": "satMaliyet",
      "pay": {
        "min": 0.5,
        "max": 0.7,
        "tipik": 0.6
      },
      "kaynak": "2007/13033 (I) sayılı liste %1 (5189 s.CK)"
    },
    {
      "girdiKodu": "AMBALAJ",
      "girdiAdi": "Karton/şişe/kapak (%20)",
      "kdvOrani": 20,
      "istisnaTipi": null,
      "kovaTipi": "INDIRILECEK",
      "matrahKaynagi": "satMaliyet",
      "pay": {
        "min": 0.1,
        "max": 0.2,
        "tipik": 0.15
      },
      "kaynak": "2007/13033 m.1 genel oran %20"
    },
    {
      "girdiKodu": "ENERJI_ELEKTRIK",
      "girdiAdi": "Enerji/soğuk zincir (%20)",
      "kdvOrani": 20,
      "istisnaTipi": null,
      "kovaTipi": "INDIRILECEK",
      "matrahKaynagi": "satMaliyet",
      "pay": {
        "min": 0.08,
        "max": 0.15,
        "tipik": 0.12
      },
      "kaynak": "2007/13033 m.1 genel oran %20"
    },
    {
      "girdiKodu": "ISLEME_ISCILIK",
      "girdiAdi": "İşleme/fason (%20)",
      "kdvOrani": 20,
      "istisnaTipi": null,
      "kovaTipi": "INDIRILECEK",
      "matrahKaynagi": "satMaliyet",
      "pay": {
        "min": 0.05,
        "max": 0.12,
        "tipik": 0.08
      },
      "kaynak": "2007/13033 m.1 genel oran %20"
    },
    {
      "girdiKodu": "YARDIMCI_KIMYASAL",
      "girdiAdi": "Maya/kültür/katkı (%20)",
      "kdvOrani": 20,
      "istisnaTipi": null,
      "kovaTipi": "INDIRILECEK",
      "matrahKaynagi": "satMaliyet",
      "pay": {
        "min": 0.0,
        "max": 0.08,
        "tipik": 0.05
      },
      "kaynak": "2007/13033 m.1 genel oran %20"
    },
    {
      "girdiKodu": "NAKLIYE_LOJISTIK",
      "girdiAdi": "Soğuk nakliye (%20)",
      "kdvOrani": 20,
      "istisnaTipi": null,
      "kovaTipi": "OPEX",
      "matrahKaynagi": "faalGider",
      "pay": {
        "min": 0.2,
        "max": 0.5,
        "tipik": 0.35
      },
      "kaynak": "2007/13033 m.1 genel oran %20"
    },
    {
      "girdiKodu": "OPEX_20",
      "girdiAdi": "Kira/bakım (%20)",
      "kdvOrani": 20,
      "istisnaTipi": null,
      "kovaTipi": "OPEX",
      "matrahKaynagi": "faalGider",
      "pay": {
        "min": 0.3,
        "max": 0.6,
        "tipik": 0.45
      },
      "kaynak": "2007/13033 m.1 genel oran %20"
    }
  ],
  "tevkifat": null,
  "iadeBaglantisi": {
    "tur": "INDIRIMLI_ORAN_29_2",
    "motorRejim": "INDIRIMLI_ORAN",
    "nakdenGecikmeAy": 12,
    "aciklama": "Süt %1, ambalaj/enerji/soğuk zincir %20 -> güçlü devreden."
  },
  "karmaOranFormulu": "hesaplanan391 = Σ(brutSatis*ciroPayi*oran) [SUT_YUMURTA(1%) + ISLENMIS_GIDA_10(10%)] ; indirilecek191 = Σ(SMM*pay*oran) [CIG_SUT_1(1%) + AMBALAJ(20%) + ENERJI_ELEKTRIK(20%) + ISLEME_ISCILIK(20%) + YARDIMCI_KIMYASAL(20%)] + Σ(faalGider*pay*oran) [OPEX: NAKLIYE_LOJISTIK(20%) + OPEX_20(20%)]"
}