{
  "sektorMeta": {
    "id": "tekstil-konfeksiyon",
    "ad": "Tekstil / Konfeksiyon",
    "kdvRejimi": "KARMA",
    "gecerlilikYili": 2026,
    "guven": "orta",
    "netPozisyonTipik": "DEVREDEN",
    "uiGrup": "imalat",
    "altDal": "uretim",
    "kaynaklar": [
      "(II) liste tekstil/giyim %10 (7346 sonrası korundu)",
      "KDVK 29/2 + 11/1-a"
    ],
    "notlar": []
  },
  "satisKalemleri": [
    {
      "urunKodu": "TEKSTIL_10",
      "urunAdi": "Tekstil/giyim yurtiçi (%10)",
      "kdvOrani": 10,
      "istisnaTipi": null,
      "matrahKaynagi": "brutSatis",
      "varsayilanCiroPayi": {
        "min": 0.5,
        "max": 0.95,
        "tipik": 0.8
      },
      "kaynak": "(II) liste"
    },
    {
      "urunKodu": "IHRACAT",
      "urunAdi": "Tekstil ihracatı (%0)",
      "kdvOrani": 0,
      "istisnaTipi": "ihracat",
      "matrahKaynagi": "brutSatis",
      "varsayilanCiroPayi": {
        "min": 0.0,
        "max": 0.5,
        "tipik": 0.2
      },
      "kaynak": "KDVK 11/1-a"
    }
  ],
  "alisKalemleri": [
    {
      "girdiKodu": "HAMMADDE_TEKSTIL_10",
      "girdiAdi": "İplik/kumaş (%10)",
      "kdvOrani": 10,
      "istisnaTipi": null,
      "kovaTipi": "INDIRILECEK",
      "matrahKaynagi": "satMaliyet",
      "pay": {
        "min": 0.45,
        "max": 0.68,
        "tipik": 0.58
      },
      "kaynak": "(II) liste"
    },
    {
      "girdiKodu": "KIMYASAL_BOYA_20",
      "girdiAdi": "Boya/kimyasal/aksesuar (%20)",
      "kdvOrani": 20,
      "istisnaTipi": null,
      "kovaTipi": "INDIRILECEK",
      "matrahKaynagi": "satMaliyet",
      "pay": {
        "min": 0.08,
        "max": 0.2,
        "tipik": 0.14
      },
      "kaynak": "2007/13033 m.1 genel oran %20"
    },
    {
      "girdiKodu": "AMBALAJ",
      "girdiAdi": "Ambalaj/etiket (%20)",
      "kdvOrani": 20,
      "istisnaTipi": null,
      "kovaTipi": "INDIRILECEK",
      "matrahKaynagi": "satMaliyet",
      "pay": {
        "min": 0.0,
        "max": 0.08,
        "tipik": 0.04
      },
      "kaynak": "2007/13033 m.1 genel oran %20"
    },
    {
      "girdiKodu": "ENERJI_ELEKTRIK",
      "girdiAdi": "Enerji (%20)",
      "kdvOrani": 20,
      "istisnaTipi": null,
      "kovaTipi": "INDIRILECEK",
      "matrahKaynagi": "satMaliyet",
      "pay": {
        "min": 0.06,
        "max": 0.16,
        "tipik": 0.12
      },
      "kaynak": "2007/13033 m.1 genel oran %20"
    },
    {
      "girdiKodu": "FASON_TEKSTIL_10",
      "girdiAdi": "Fason dikim/konfeksiyon işçiliği (%10)",
      "kdvOrani": 10,
      "istisnaTipi": null,
      "kovaTipi": "INDIRILECEK",
      "matrahKaynagi": "satMaliyet",
      "pay": {
        "min": 0.0,
        "max": 0.15,
        "tipik": 0.08
      },
      "kaynak": "(II) liste B/10 fason tekstil %10"
    },
    {
      "girdiKodu": "NAKLIYE_LOJISTIK",
      "girdiAdi": "Nakliye (%20)",
      "kdvOrani": 20,
      "istisnaTipi": null,
      "kovaTipi": "OPEX",
      "matrahKaynagi": "faalGider",
      "pay": {
        "min": 0.1,
        "max": 0.4,
        "tipik": 0.3
      },
      "kaynak": "2007/13033 m.1 genel oran %20"
    },
    {
      "girdiKodu": "OPEX_20",
      "girdiAdi": "Diğer (%20)",
      "kdvOrani": 20,
      "istisnaTipi": null,
      "kovaTipi": "OPEX",
      "matrahKaynagi": "faalGider",
      "pay": {
        "min": 0.2,
        "max": 0.6,
        "tipik": 0.4
      },
      "kaynak": "2007/13033 m.1 genel oran %20"
    },
    {
      "girdiKodu": "KDVSIZ_GIDER",
      "girdiAdi": "KDV'siz maliyet payı (ücret/amortisman/öz üretim)",
      "kdvOrani": 0,
      "istisnaTipi": "kdvsiz",
      "kovaTipi": "INDIRILECEK",
      "matrahKaynagi": "satMaliyet",
      "pay": {
        "min": 0.04,
        "max": 0.04,
        "tipik": 0.04
      },
      "kaynak": "KDV'siz maliyet (GVK ücret/amortisman) — indirilecek KDV doğurmaz"
    }
  ],
  "tevkifat": null,
  "iadeBaglantisi": {
    "tur": "INDIRIMLI_ORAN_29_2",
    "motorRejim": "INDIRIMLI_ORAN",
    "nakdenGecikmeAy": 12,
    "aciklama": "Satış %10, boya/enerji %20 + ihracat -> 29/2 + 11/1-a. Fason dikim 7/10 (alıcı)."
  },
  "karmaOranFormulu": "hesaplanan391 = Σ(brutSatis*ciroPayi*oran) [TEKSTIL_10(10%) + IHRACAT(0%)] ; indirilecek191 = Σ(SMM*pay*oran) [HAMMADDE_TEKSTIL_10(10%) + KIMYASAL_BOYA_20(20%) + AMBALAJ(20%) + ENERJI_ELEKTRIK(20%) + FASON_TEKSTIL_10(10%)] + Σ(faalGider*pay*oran) [OPEX: NAKLIYE_LOJISTIK(20%) + OPEX_20(20%)]"
}