{
  "sektorMeta": {
    "id": "un-irmik-uretim",
    "ad": "Un / İrmik Üretimi",
    "kdvRejimi": "INDIRIMLI_ORAN",
    "gecerlilikYili": 2026,
    "guven": "orta",
    "netPozisyonTipik": "DEVREDEN",
    "uiGrup": "gida",
    "altDal": "uretim",
    "kaynaklar": [
      "(I) liste değirmencilik ürünleri %1",
      "KDVK 29/2"
    ],
    "notlar": []
  },
  "satisKalemleri": [
    {
      "urunKodu": "TEMEL_GIDA",
      "urunAdi": "Un/irmik/değirmencilik (%1)",
      "kdvOrani": 1,
      "istisnaTipi": null,
      "matrahKaynagi": "brutSatis",
      "varsayilanCiroPayi": {
        "min": 0.95,
        "max": 1.0,
        "tipik": 1.0
      },
      "kaynak": "2007/13033 (I) sayılı liste %1 (5189 s.CK)"
    }
  ],
  "alisKalemleri": [
    {
      "girdiKodu": "BUGDAY_TAHIL_ALIS",
      "girdiAdi": "Buğday/tahıl (%1)",
      "kdvOrani": 1,
      "istisnaTipi": null,
      "kovaTipi": "INDIRILECEK",
      "matrahKaynagi": "satMaliyet",
      "pay": {
        "min": 0.65,
        "max": 0.8,
        "tipik": 0.72
      },
      "kaynak": "2007/13033 (I) sayılı liste %1 (5189 s.CK)"
    },
    {
      "girdiKodu": "AMBALAJ",
      "girdiAdi": "Çuval/big-bag (%20)",
      "kdvOrani": 20,
      "istisnaTipi": null,
      "kovaTipi": "INDIRILECEK",
      "matrahKaynagi": "satMaliyet",
      "pay": {
        "min": 0.05,
        "max": 0.12,
        "tipik": 0.08
      },
      "kaynak": "2007/13033 m.1 genel oran %20"
    },
    {
      "girdiKodu": "ENERJI_ELEKTRIK",
      "girdiAdi": "Elektrik/öğütme (%20)",
      "kdvOrani": 20,
      "istisnaTipi": null,
      "kovaTipi": "INDIRILECEK",
      "matrahKaynagi": "satMaliyet",
      "pay": {
        "min": 0.06,
        "max": 0.14,
        "tipik": 0.1
      },
      "kaynak": "2007/13033 m.1 genel oran %20"
    },
    {
      "girdiKodu": "ISLEME_ISCILIK",
      "girdiAdi": "İşçilik/bakım (%20)",
      "kdvOrani": 20,
      "istisnaTipi": null,
      "kovaTipi": "INDIRILECEK",
      "matrahKaynagi": "satMaliyet",
      "pay": {
        "min": 0.0,
        "max": 0.08,
        "tipik": 0.05
      },
      "kaynak": "2007/13033 m.1 genel oran %20"
    },
    {
      "girdiKodu": "NAKLIYE_LOJISTIK",
      "girdiAdi": "Nakliye (%20)",
      "kdvOrani": 20,
      "istisnaTipi": null,
      "kovaTipi": "OPEX",
      "matrahKaynagi": "faalGider",
      "pay": {
        "min": 0.1,
        "max": 0.4,
        "tipik": 0.3
      },
      "kaynak": "2007/13033 m.1 genel oran %20"
    },
    {
      "girdiKodu": "OPEX_20",
      "girdiAdi": "Kira/diğer (%20)",
      "kdvOrani": 20,
      "istisnaTipi": null,
      "kovaTipi": "OPEX",
      "matrahKaynagi": "faalGider",
      "pay": {
        "min": 0.3,
        "max": 0.7,
        "tipik": 0.5
      },
      "kaynak": "2007/13033 m.1 genel oran %20"
    },
    {
      "girdiKodu": "KDVSIZ_GIDER",
      "girdiAdi": "KDV'siz maliyet payı (ücret/amortisman/öz üretim)",
      "kdvOrani": 0,
      "istisnaTipi": "kdvsiz",
      "kovaTipi": "INDIRILECEK",
      "matrahKaynagi": "satMaliyet",
      "pay": {
        "min": 0.05,
        "max": 0.05,
        "tipik": 0.05
      },
      "kaynak": "KDV'siz maliyet (GVK ücret/amortisman) — indirilecek KDV doğurmaz"
    }
  ],
  "tevkifat": null,
  "iadeBaglantisi": {
    "tur": "INDIRIMLI_ORAN_29_2",
    "motorRejim": "INDIRIMLI_ORAN",
    "nakdenGecikmeAy": 12,
    "aciklama": "Girdi-çıktı %1; ambalaj/enerji %20 -> devreden/29-2."
  },
  "karmaOranFormulu": "hesaplanan391 = Σ(brutSatis*ciroPayi*oran) [TEMEL_GIDA(1%)] ; indirilecek191 = Σ(SMM*pay*oran) [BUGDAY_TAHIL_ALIS(1%) + AMBALAJ(20%) + ENERJI_ELEKTRIK(20%) + ISLEME_ISCILIK(20%)] + Σ(faalGider*pay*oran) [OPEX: NAKLIYE_LOJISTIK(20%) + OPEX_20(20%)]"
}