{
  "sektorMeta": {
    "id": "hammadde-ticaret",
    "ad": "Hammadde Ticareti",
    "kdvRejimi": "GENEL",
    "gecerlilikYili": 2026,
    "guven": "yuksek",
    "netPozisyonTipik": "ODENECEK",
    "uiGrup": "ticaret",
    "altDal": "ticaret",
    "kaynaklar": [
      "2007/13033 m.1 genel oran %20"
    ],
    "notlar": []
  },
  "satisKalemleri": [
    {
      "urunKodu": "GENEL_MAL",
      "urunAdi": "Hammadde/ara mal (%20)",
      "kdvOrani": 20,
      "istisnaTipi": null,
      "matrahKaynagi": "brutSatis",
      "varsayilanCiroPayi": {
        "min": 0.95,
        "max": 1.0,
        "tipik": 1.0
      },
      "kaynak": "2007/13033 m.1 genel oran %20"
    }
  ],
  "alisKalemleri": [
    {
      "girdiKodu": "TICARI_MAL_20",
      "girdiAdi": "Hammadde alışı (%20)",
      "kdvOrani": 20,
      "istisnaTipi": null,
      "kovaTipi": "INDIRILECEK",
      "matrahKaynagi": "satMaliyet",
      "pay": {
        "min": 0.85,
        "max": 0.96,
        "tipik": 0.92
      },
      "kaynak": "2007/13033 m.1 genel oran %20"
    },
    {
      "girdiKodu": "NAKLIYE_LOJISTIK",
      "girdiAdi": "Nakliye (SMM, %20)",
      "kdvOrani": 20,
      "istisnaTipi": null,
      "kovaTipi": "INDIRILECEK",
      "matrahKaynagi": "satMaliyet",
      "pay": {
        "min": 0.0,
        "max": 0.08,
        "tipik": 0.04
      },
      "kaynak": "2007/13033 m.1 genel oran %20"
    },
    {
      "girdiKodu": "AMBALAJ",
      "girdiAdi": "Ambalaj (%20)",
      "kdvOrani": 20,
      "istisnaTipi": null,
      "kovaTipi": "INDIRILECEK",
      "matrahKaynagi": "satMaliyet",
      "pay": {
        "min": 0.0,
        "max": 0.05,
        "tipik": 0.02
      },
      "kaynak": "2007/13033 m.1 genel oran %20"
    },
    {
      "girdiKodu": "ENERJI_ELEKTRIK",
      "girdiAdi": "Depo enerji (%20)",
      "kdvOrani": 20,
      "istisnaTipi": null,
      "kovaTipi": "OPEX",
      "matrahKaynagi": "faalGider",
      "pay": {
        "min": 0.1,
        "max": 0.4,
        "tipik": 0.3
      },
      "kaynak": "2007/13033 m.1 genel oran %20"
    },
    {
      "girdiKodu": "OPEX_20",
      "girdiAdi": "Kira/diğer (%20)",
      "kdvOrani": 20,
      "istisnaTipi": null,
      "kovaTipi": "OPEX",
      "matrahKaynagi": "faalGider",
      "pay": {
        "min": 0.2,
        "max": 0.6,
        "tipik": 0.4
      },
      "kaynak": "2007/13033 m.1 genel oran %20"
    },
    {
      "girdiKodu": "KDVSIZ_GIDER",
      "girdiAdi": "KDV'siz maliyet payı (ücret/amortisman/öz üretim)",
      "kdvOrani": 0,
      "istisnaTipi": "kdvsiz",
      "kovaTipi": "INDIRILECEK",
      "matrahKaynagi": "satMaliyet",
      "pay": {
        "min": 0.02,
        "max": 0.02,
        "tipik": 0.02
      },
      "kaynak": "KDV'siz maliyet (GVK ücret/amortisman) — indirilecek KDV doğurmaz"
    }
  ],
  "tevkifat": null,
  "iadeBaglantisi": {
    "tur": null,
    "motorRejim": "GENEL",
    "nakdenGecikmeAy": 0,
    "aciklama": "Dar marj; net ödenecek KDV düşük."
  },
  "karmaOranFormulu": "hesaplanan391 = Σ(brutSatis*ciroPayi*oran) [GENEL_MAL(20%)] ; indirilecek191 = Σ(SMM*pay*oran) [TICARI_MAL_20(20%) + NAKLIYE_LOJISTIK(20%) + AMBALAJ(20%)] + Σ(faalGider*pay*oran) [OPEX: ENERJI_ELEKTRIK(20%) + OPEX_20(20%)]"
}